{
  "description": "An acquisition, decoding, cleanup, interpretation, extraction, and evidence scaffold for unknown or unstructured documents.",
  "domains": [
    "data-engineering.documents",
    "ai.document-intelligence"
  ],
  "extensions": {
    "universal.template-source": "linear-blueprint",
    "universal.template-state": "schematic; refine before execution"
  },
  "id": "template.document-intelligence",
  "program": {
    "allowed_effects": [],
    "edges": [
      {
        "source_port": "state",
        "source_slot": "receive_document",
        "target_port": "state",
        "target_slot": "detect_format"
      },
      {
        "source_port": "state",
        "source_slot": "detect_format",
        "target_port": "state",
        "target_slot": "malware_policy"
      },
      {
        "source_port": "state",
        "source_slot": "malware_policy",
        "target_port": "state",
        "target_slot": "repair_container"
      },
      {
        "source_port": "state",
        "source_slot": "repair_container",
        "target_port": "state",
        "target_slot": "extract_native_text"
      },
      {
        "source_port": "state",
        "source_slot": "extract_native_text",
        "target_port": "state",
        "target_slot": "render_pages"
      },
      {
        "source_port": "state",
        "source_slot": "render_pages",
        "target_port": "state",
        "target_slot": "recognize_text"
      },
      {
        "source_port": "state",
        "source_slot": "recognize_text",
        "target_port": "state",
        "target_slot": "remove_boilerplate"
      },
      {
        "source_port": "state",
        "source_slot": "remove_boilerplate",
        "target_port": "state",
        "target_slot": "normalize_symbols"
      },
      {
        "source_port": "state",
        "source_slot": "normalize_symbols",
        "target_port": "state",
        "target_slot": "translate_content"
      },
      {
        "source_port": "state",
        "source_slot": "translate_content",
        "target_port": "state",
        "target_slot": "segment_structure"
      },
      {
        "source_port": "state",
        "source_slot": "segment_structure",
        "target_port": "state",
        "target_slot": "prioritize_regions"
      },
      {
        "source_port": "state",
        "source_slot": "prioritize_regions",
        "target_port": "state",
        "target_slot": "extract_deterministic"
      },
      {
        "source_port": "state",
        "source_slot": "extract_deterministic",
        "target_port": "state",
        "target_slot": "extract_model_assisted"
      },
      {
        "source_port": "state",
        "source_slot": "extract_model_assisted",
        "target_port": "state",
        "target_slot": "reconcile_candidates"
      },
      {
        "source_port": "state",
        "source_slot": "reconcile_candidates",
        "target_port": "state",
        "target_slot": "validate_schema"
      },
      {
        "source_port": "state",
        "source_slot": "validate_schema",
        "target_port": "state",
        "target_slot": "ground_output"
      },
      {
        "source_port": "state",
        "source_slot": "ground_output",
        "target_port": "state",
        "target_slot": "publish_record"
      }
    ],
    "granted_permissions": [],
    "id": "program.template.document-intelligence",
    "inputs": [
      {
        "name": "input",
        "target_port": "state",
        "target_slot": "receive_document",
        "type": {
          "id": "template.document-intelligence.state-0",
          "media_type": "application/json",
          "schema_digest": "",
          "units": "",
          "version": "1"
        }
      }
    ],
    "invariants": [],
    "model_version": "0.2",
    "outputs": [
      {
        "name": "result",
        "source_port": "state",
        "source_slot": "publish_record",
        "type": {
          "id": "template.document-intelligence.state-18",
          "media_type": "application/json",
          "schema_digest": "",
          "units": "",
          "version": "1"
        }
      }
    ],
    "slots": [
      {
        "activation_port": "",
        "activation_slot": "",
        "activation_values": [],
        "allowed_effects": [],
        "group": [
          "stage.acquire"
        ],
        "id": "receive_document",
        "inputs": [
          {
            "cardinality": "one",
            "description": "",
            "name": "state",
            "type": {
              "id": "template.document-intelligence.state-0",
              "media_type": "application/json",
              "schema_digest": "",
              "units": "",
              "version": "1"
            }
          }
        ],
        "kind": "atomic",
        "optional": false,
        "outputs": [
          {
            "cardinality": "one",
            "description": "",
            "name": "state",
            "type": {
              "id": "template.document-intelligence.state-1",
              "media_type": "application/json",
              "schema_digest": "",
              "units": "",
              "version": "1"
            }
          }
        ],
        "purpose": "Receive a document with immutable source metadata.",
        "required_capabilities": [
          "template.document-intelligence.receive_document.perform"
        ],
        "subgraph_ref": "",
        "success_contract": "Receive a document with immutable source metadata and preserve every invariant required by later slots."
      },
      {
        "activation_port": "",
        "activation_slot": "",
        "activation_values": [],
        "allowed_effects": [],
        "group": [
          "stage.acquire"
        ],
        "id": "detect_format",
        "inputs": [
          {
            "cardinality": "one",
            "description": "",
            "name": "state",
            "type": {
              "id": "template.document-intelligence.state-1",
              "media_type": "application/json",
              "schema_digest": "",
              "units": "",
              "version": "1"
            }
          }
        ],
        "kind": "atomic",
        "optional": false,
        "outputs": [
          {
            "cardinality": "one",
            "description": "",
            "name": "state",
            "type": {
              "id": "template.document-intelligence.state-2",
              "media_type": "application/json",
              "schema_digest": "",
              "units": "",
              "version": "1"
            }
          }
        ],
        "purpose": "Detect container, encoding, language hints, and corruption.",
        "required_capabilities": [
          "template.document-intelligence.detect_format.perform"
        ],
        "subgraph_ref": "",
        "success_contract": "Detect container, encoding, language hints, and corruption and preserve every invariant required by later slots."
      },
      {
        "activation_port": "",
        "activation_slot": "",
        "activation_values": [],
        "allowed_effects": [],
        "group": [
          "stage.acquire"
        ],
        "id": "malware_policy",
        "inputs": [
          {
            "cardinality": "one",
            "description": "",
            "name": "state",
            "type": {
              "id": "template.document-intelligence.state-2",
              "media_type": "application/json",
              "schema_digest": "",
              "units": "",
              "version": "1"
            }
          }
        ],
        "kind": "atomic",
        "optional": false,
        "outputs": [
          {
            "cardinality": "one",
            "description": "",
            "name": "state",
            "type": {
              "id": "template.document-intelligence.state-3",
              "media_type": "application/json",
              "schema_digest": "",
              "units": "",
              "version": "1"
            }
          }
        ],
        "purpose": "Apply the declared content safety and quarantine policy.",
        "required_capabilities": [
          "template.document-intelligence.malware_policy.perform"
        ],
        "subgraph_ref": "",
        "success_contract": "Apply the declared content safety and quarantine policy and preserve every invariant required by later slots."
      },
      {
        "activation_port": "",
        "activation_slot": "",
        "activation_values": [],
        "allowed_effects": [],
        "group": [
          "stage.decode"
        ],
        "id": "repair_container",
        "inputs": [
          {
            "cardinality": "one",
            "description": "",
            "name": "state",
            "type": {
              "id": "template.document-intelligence.state-3",
              "media_type": "application/json",
              "schema_digest": "",
              "units": "",
              "version": "1"
            }
          }
        ],
        "kind": "atomic",
        "optional": false,
        "outputs": [
          {
            "cardinality": "one",
            "description": "",
            "name": "state",
            "type": {
              "id": "template.document-intelligence.state-4",
              "media_type": "application/json",
              "schema_digest": "",
              "units": "",
              "version": "1"
            }
          }
        ],
        "purpose": "Repair or reject malformed containers without inventing content.",
        "required_capabilities": [
          "template.document-intelligence.repair_container.perform"
        ],
        "subgraph_ref": "",
        "success_contract": "Repair or reject malformed containers without inventing content and preserve every invariant required by later slots."
      },
      {
        "activation_port": "",
        "activation_slot": "",
        "activation_values": [],
        "allowed_effects": [],
        "group": [